{
  "type": "analysisNarrowTable",
  "primitive": "analysisNarrowTable@1",
  "description": "Analysis with narrow table",
  "templateLayout": "Analysis_narrow table",
  "geometry": {
    "titleBox": {
      "x": 1.0918635170603674,
      "y": 0.4722222222222222,
      "w": 11.149606299212598,
      "h": 0.5833333333333334
    },
    "straplineBox": {
      "x": 1.088540026246719,
      "y": 1.2899311023622047,
      "w": 11.149606299212598,
      "h": 0.5275590551181102
    },
    "tableBox": {
      "x": 1.088540026246719,
      "y": 1.9155555555555555,
      "w": 4.035978783902012,
      "h": 4.5078740157480315
    },
    "rightTitleBox": {
      "x": 5.266138451443569,
      "y": 1.9155555555555555,
      "w": 6.9763779527559056,
      "h": 0.2755905511811024
    },
    "rightBodyBox": {
      "x": 5.266138451443569,
      "y": 2.191146106736658,
      "w": 6.975332458442694,
      "h": 4.232283464566929
    }
  },
  "slots": {
    "notes": {
      "kind": "text",
      "required": false,
      "minChars": 12,
      "maxChars": 700,
      "allowEmpty": false,
      "renderingHints": {
        "mode": "paragraph",
        "keepTogether": true,
        "priority": "medium"
      }
    },
    "strapline": {
      "kind": "text",
      "required": false,
      "minChars": 12,
      "maxChars": 700,
      "allowEmpty": false,
      "renderingHints": {
        "mode": "paragraph",
        "keepTogether": true,
        "priority": "medium"
      }
    },
    "table": {
      "kind": "table",
      "required": true,
      "minItems": 3,
      "allowEmpty": false,
      "renderingHints": {
        "mode": "table",
        "keepTogether": true,
        "priority": "high"
      }
    },
    "title": {
      "kind": "text",
      "required": true,
      "minChars": 12,
      "maxChars": 50,
      "allowEmpty": false,
      "renderingHints": {
        "mode": "paragraph",
        "keepTogether": true,
        "priority": "medium"
      },
      "enforceMaxChars": true
    },
    "insights": {
      "kind": "textArray",
      "required": true,
      "minItems": 2,
      "minChars": 80,
      "allowEmpty": false,
      "renderingHints": {
        "mode": "bullet",
        "keepTogether": false,
        "priority": "high"
      }
    },
    "insightTitle": {
      "kind": "text",
      "required": false,
      "minChars": 6,
      "maxChars": 80,
      "allowEmpty": true,
      "renderingHints": {
        "mode": "heading",
        "keepTogether": true,
        "priority": "high"
      }
    }
  },
  "densityTarget": {
    "mode": "balanced",
    "minScore": 0.75
  }
}
