{
  "type": "titleStrapline4TextBoxes",
  "primitive": "titleStrapline4TextBoxes@1",
  "description": "Title + strapline + 4 text boxes",
  "templateLayout": "Title+strapline+4 text boxes",
  "geometry": {
    "titleBox": {
      "x": 1.0918635170603674,
      "y": 0.4722222222222222,
      "w": 11.149606299212598,
      "h": 0.5833333333333334
    },
    "straplineBox": {
      "x": 1.0919,
      "y": 1.2899,
      "w": 11.1496,
      "h": 0.5276
    },
    "columnBoxes": [
      {
        "x": 1.0919,
        "y": 1.2899,
        "w": 2.6,
        "h": 5.16
      },
      {
        "x": 3.9,
        "y": 1.2899,
        "w": 2.6,
        "h": 5.16
      },
      {
        "x": 6.7,
        "y": 1.2899,
        "w": 2.6,
        "h": 5.16
      },
      {
        "x": 9.5,
        "y": 1.2899,
        "w": 2.6,
        "h": 5.16
      }
    ]
  },
  "slots": {
    "columns": {
      "kind": "columns",
      "required": true,
      "minItems": 4,
      "allowEmpty": false,
      "renderingHints": {
        "mode": "columns",
        "keepTogether": true,
        "priority": "high"
      }
    },
    "strapline": {
      "kind": "text",
      "required": false,
      "minChars": 12,
      "maxChars": 700,
      "allowEmpty": false,
      "renderingHints": {
        "mode": "paragraph",
        "keepTogether": true,
        "priority": "medium"
      }
    },
    "title": {
      "kind": "text",
      "required": true,
      "minChars": 12,
      "maxChars": 50,
      "allowEmpty": false,
      "renderingHints": {
        "mode": "paragraph",
        "keepTogether": true,
        "priority": "medium"
      },
      "enforceMaxChars": true
    },
    "bodyStyle": {
      "kind": "text",
      "required": false,
      "minChars": 7,
      "maxChars": 10,
      "pattern": "^(bullets|paragraphs)$",
      "allowEmpty": false,
      "renderingHints": {
        "mode": "label",
        "keepTogether": true,
        "priority": "low"
      }
    }
  },
  "densityTarget": {
    "mode": "balanced",
    "minScore": 0.75
  }
}
