{
  "type": "cover",
  "primitive": "cover@1",
  "description": "Cover with blue background, left title, right image window",
  "templateLayout": "Cover page_Right Horizontal Window",
  "geometry": {
    "titleBox": {
      "x": 1.0919488188976378,
      "y": 1.5927252843394575,
      "w": 4.043974190726159,
      "h": 3.7486253280839894
    },
    "subtitleBox": {
      "x": 1.0919488188976378,
      "y": 5.475732720909886,
      "w": 4.043974190726159,
      "h": 0.8858267716535433
    },
    "photoBox": {
      "x": 5.37616469816273,
      "y": 1.5927252843394575,
      "w": 6.872099737532809,
      "h": 4.77361220472441
    },
    "logoBox": {
      "x": 1.0919466316710411,
      "y": 0.4060706474190726,
      "w": 1,
      "h": 0.4028280839895013
    }
  },
  "slots": {
    "subtitle": {
      "kind": "text",
      "maxLength": 200,
      "required": true,
      "minChars": 12,
      "maxChars": 200,
      "allowEmpty": false,
      "renderingHints": {
        "mode": "paragraph",
        "keepTogether": true,
        "priority": "high"
      }
    },
    "title": {
      "kind": "text",
      "maxLength": 100,
      "required": true,
      "minChars": 8,
      "maxChars": 100,
      "allowEmpty": false,
      "renderingHints": {
        "mode": "heading",
        "keepTogether": true,
        "priority": "high"
      }
    }
  },
  "densityTarget": {
    "mode": "balanced",
    "minScore": 0.65
  }
}
