{
  "type": "divider",
  "primitive": "divider@1",
  "description": "Section divider with gradient window",
  "templateLayout": "Divider slide_5",
  "geometry": {
    "gradientBox": {
      "x": 1.0919466316710411,
      "y": 1.0674245406824148,
      "w": 7.722863079615048,
      "h": 5.364583333333333
    },
    "numberBox": {
      "x": 1.4106080489938757,
      "y": 1.246794619422572,
      "w": 1.1840277777777777,
      "h": 0.8885936132983377
    },
    "titleBox": {
      "x": 1.410609142607174,
      "y": 2.385036089238845,
      "w": 6.913194444444445,
      "h": 0.7620100612423447
    }
  },
  "slots": {
    "sectionNumber": {
      "kind": "text",
      "pattern": "^\\d{2}$",
      "required": true,
      "minChars": 2,
      "maxChars": 2,
      "allowEmpty": false,
      "renderingHints": {
        "mode": "label",
        "keepTogether": true,
        "priority": "high"
      }
    },
    "sectionTitle": {
      "kind": "text",
      "maxLength": 80,
      "required": true,
      "minChars": 6,
      "maxChars": 80,
      "allowEmpty": false,
      "renderingHints": {
        "mode": "heading",
        "keepTogether": true,
        "priority": "high"
      }
    }
  },
  "densityTarget": {
    "mode": "balanced",
    "minScore": 0.75
  }
}
